{
  "meta": {"schema_version": "1.0", "skill": "neoclassical-editorial-image", "style_system": "contemporary-neoclassical-editorial-collage", "target_model": "flux", "task_type": "text_to_image", "prompt_complexity": "standard"},
  "creative_brief": {"source": "technology brief: cybersecurity", "topic": "cybersecurity as civic defense", "thesis": "The image is really about fragile openness guarded by ancient vigilance.", "abstract_concept": "Classical fortress logic applied to network defense", "visual_metaphor": "A marble watchtower-owl perched on a server bastion, wings spread over a tiny engraved city threaded with glowing cables", "image_goal": "Tech editorial hero with mythic vigilance, not hacker cliches"},
  "art_direction": {"style_name": "Contemporary Neoclassical Editorial Collage", "style_archetype": "neoclassical-pop-editorial", "historical_language": "marble owl, bastion stonework, engraved city plan, laurel and shield motifs", "contemporary_language": "server racks, fiber cables, warning beacons, QR-like seals", "medium": "mixed-media editorial collage, engraving plus halftone screen print", "rendering_language": "cross-hatched feathers and stone with halftone cable glow", "composition_language": "A hero-plus-symbolic-object, vigilant bird over guarded city", "color_strategy": "cyan support field with deep ink hero and orange alert accent", "texture_strategy": "engraving lines, stipple feathers, halftone, paper grain, ink breakup", "mood": "sophisticated, provocative, watchful"},
  "visual_spec": {"hero_subject": "large marble owl with spread engraved wings perched on a server-rack bastion block", "supporting_elements": ["tiny engraved city with glowing cable threads", "small shield-seals and beacon lights", "fragmented firewall portcullis bars"], "environment": "saturated cyan field with faint classical cornice lines", "composition": "Pattern A: owl-bastion center at 65% scale, city cradled below wings, diagonal cable lines leading eye, dark margins top and bottom", "spatial_relationships": "foreground city, midground bastion, apex owl with overlapping wings", "perspective": "slightly elevated poster view, deep focus", "lighting": "directional graphic light, ink wing shadows, symbolic orange beacon glow", "color_palette": ["#18A8C7", "#0B0C0C", "#F3EFE5", "#FF8A00"], "color_hierarchy": "cyan ground, ink-cream hero, orange alert accent", "materials": ["marble", "carved stone", "printed paper", "brushed metal"], "textures": ["fine engraving lines", "stipple dots", "halftone", "paper grain"], "atmosphere": "tense still air before alarm", "negative_space": "cyan bands top and bottom", "typography": "no text, wordless editorial illustration"},
  "style_constraints": {"non_negotiables": ["old x new tension (owl-bastion x servers)", "vigilance metaphor", "engraved rendering", "saturated ground", "ink anchor", "print texture"], "preferred": ["wing-shelter gesture", "diagonal cables"], "avoid": ["hooded hacker cliche", "glossy CGI", "green matrix rain", "shallow depth of field"]},
  "reference_strategy": {"references_present": false, "reference_roles": [], "style_reference": "", "composition_reference": "", "content_reference": "", "reference_strength": null},
  "prompt_strategy": {"complexity": "standard", "reason": "FLUX sweet spot 30-80 words, front-loaded subject", "prompt_structure": ["subject", "action", "style", "context"], "model_specific_strategy": "flux: front-load owl-bastion, HEX bound to objects, no negative prompt"},
  "prompts": {"primary": "Engraved editorial collage with screen-print finish: a large marble owl with spread cross-hatched wings perched on a server-rack bastion block sheltering a tiny engraved city threaded with glowing cables below, fragmented firewall portcullis bars and small shield-seals with orange beacons around the base. Saturated cyan background with faint classical cornice lines, centered poster composition with owl-bastion at 65 percent scale and cyan negative bands top and bottom. Deep ink and cream hero rendering with single orange alert accent, fine engraving lines, stippled feathers, halftone, paper grain and ink breakup, directional graphic light with wing shadow masses, antique print through modern screen printing, watchful sophisticated tech-editorial mood, wordless.", "compact": "Marble owl guarding server bastion over tiny cable city, cyan engraved collage, ink hero, orange accent.", "model_specific": "A marble owl with spread wings guarding a server-rack bastion over a tiny engraved city threaded with glowing cables, engraving and screen-print editorial style, wings in deep ink #0B0C0C on cyan field #18A8C7 with orange beacons #FF8A00, centered poster composition"},
  "negative_prompt": {"enabled": false, "content": ""},
  "generation_parameters": {"aspect_ratio": "16:9", "width": null, "height": null, "resolution": null, "quality": null, "stylization": null, "seed": null, "model_parameters": {"note": "FLUX has no negative prompts; avoid-list folded into prose"}},
  "validation": {"valid": true, "checks": ["flux no-negative enforced", "HEX bound to objects", "front-loaded subject"], "warnings": [], "missing_information": []}
}
