{
  "meta": {"schema_version": "1.0", "skill": "neoclassical-editorial-image", "style_system": "contemporary-neoclassical-editorial-collage", "target_model": "general", "task_type": "text_to_image", "prompt_complexity": "detailed"},
  "creative_brief": {"source": "philosophical essay on memory and forgetting", "topic": "memory, forgetting, and identity", "thesis": "The image is really about identity as a fragile archive constantly rewritten.", "abstract_concept": "Classical memory palace eroded and overprinted by present", "visual_metaphor": "A cracked marble head whose cranium opens into an engraved library interior where pages dissolve into birds and pixels", "image_goal": "Contemplative philosophical cover image, strange and delightful"},
  "art_direction": {"style_name": "Contemporary Neoclassical Editorial Collage", "style_archetype": "neoclassical-pop-editorial", "historical_language": "cracked marble bust, engraved library hall, botanical plates, old diagrams", "contemporary_language": "dissolving pixels, data moths, translucent glowing index cards", "medium": "mixed-media editorial collage, scientific illustration plus screen print", "rendering_language": "fine copperplate lines with stippled marble and halftone dissolution", "composition_language": "D central-subject-plus-small-symbols, monumental head center with orbiting fragments", "color_strategy": "dark botanical green dominant bg, cream marble hero, acid lime accent on escaping birds", "texture_strategy": "fine engraving lines, stipple, halftone, paper fiber, ink absorption, misregistration", "mood": "surreal, strange, culturally literate, contemplative"},
  "visual_spec": {"hero_subject": "monumental cracked marble head in profile, cranium opening into a miniature engraved library hall with receding shelves", "supporting_elements": ["pages tearing free and turning into small birds and pixel squares", "botanical plates and diagram fragments orbiting the head", "tiny ladder and archivist silhouette inside the skull-library"], "environment": "deep botanical-green field with faint constellation grid and drifting paper dust", "composition": "Pattern D: head center at 70% scale, symmetrical but broken by escaping page-birds top-right, generous dark negative space edges, eye path eye to library to birds", "spatial_relationships": "foreground head, interior midground library, background green void with orbiting plates", "perspective": "eye-level profile view, deep apparent focus throughout", "lighting": "soft directional graphic light, deep ink shadow masses in cracks, paper-white highlights on cheekbone", "color_palette": ["#253F25", "#F3EFE5", "#0B0C0C", "#C4CF36"], "color_hierarchy": "dark green ground, cream-ink hero, acid-lime accent on birds", "materials": ["marble", "aged paper", "parchment", "ink"], "textures": ["fine engraving lines", "stipple dots", "halftone", "paper fiber"], "atmosphere": "quiet dusty archive air, slow dissolution", "negative_space": "dark green margins left and right", "typography": "no text, wordless editorial illustration"},
  "style_constraints": {"non_negotiables": ["old x new tension (bust-library x pixels)", "archive-dissolution metaphor", "engraved tactile rendering", "saturated green ground", "cream-ink anchor", "print texture"], "preferred": ["orbital fragments", "interior world inside head"], "avoid": ["generic brain with circuits", "glossy CGI", "stock photography", "neon sci-fi glow overload"]},
  "reference_strategy": {"references_present": false, "reference_roles": [], "style_reference": "", "composition_reference": "", "content_reference": "", "reference_strength": null},
  "prompt_strategy": {"complexity": "detailed", "reason": "philosophical interior world needs precise spatial nesting", "prompt_structure": ["medium", "hero", "metaphor", "composition", "contrast", "color", "texture", "light", "mood"], "model_specific_strategy": "general: detailed natural language spec"},
  "prompts": {"primary": "Scientific-illustration editorial collage with screen-print finish: a monumental cracked marble head in profile rendered in cream and black stippled engraving, its cranium opening into a miniature engraved library hall with receding shelves, a tiny ladder and lone archivist silhouette inside, loose pages tearing free and metamorphosing into small birds and pixel squares that stream top-right, botanical plates and old diagram fragments orbiting the head. Deep botanical-green background with faint constellation grid and drifting paper dust, centered monumental composition at 70 percent scale with generous dark margins, cream-ink hero with single acid-lime accent on the escaping birds, fine copperplate lines, stipple, halftone dissolution, paper fiber and slight misregistration, directional graphic light with ink shadow masses in the cracks and paper-white cheekbone highlights, antique print reproduced through modern screen printing, surreal contemplative literate mood, wordless.", "compact": "Cracked marble head opening into tiny library, pages becoming birds and pixels, green engraved collage, cream hero, lime accent.", "model_specific": "Scientific illustration collage, monumental marble head with skull-library interior, pages dissolving into birds and pixels, copperplate engraving, botanical green ground, cream hero with lime accent, centered composition, surreal contemplative mood."},
  "negative_prompt": {"enabled": true, "content": "generic brain-circuit art, glossy CGI, stock photo, neon overload, readable text, watermark"},
  "generation_parameters": {"aspect_ratio": "4:5", "width": null, "height": null, "resolution": null, "quality": null, "stylization": null, "seed": null, "model_parameters": {}},
  "validation": {"valid": true, "checks": ["metaphor present", "nested space composed", "house palette", "texture"], "warnings": [], "missing_information": []}
}
