{
  "meta": {"schema_version": "1.0", "skill": "neoclassical-editorial-image", "style_system": "contemporary-neoclassical-editorial-collage", "target_model": "general", "task_type": "text_to_image", "prompt_complexity": "standard"},
  "creative_brief": {"source": "article: AI agents are changing software development", "topic": "AI agents changing software development", "thesis": "The image is really about human craft collaborating with autonomous machine labor.", "abstract_concept": "Classical authorship meeting autonomous generation", "visual_metaphor": "A marble sculptor-figure and a floating robotic arm co-carving a glowing blueprint-column of code", "image_goal": "Editorial hero communicating collaboration, not replacement"},
  "art_direction": {"style_name": "Contemporary Neoclassical Editorial Collage", "style_archetype": "neoclassical-pop-editorial", "historical_language": "marble sculptor figure, copperplate engraving lines, classical column", "contemporary_language": "robotic arm, glowing code blueprint, neural scaffolding", "medium": "mixed-media editorial collage, copperplate etching plus screen print", "rendering_language": "cross-hatched ink drawing with stippled marble shading and halftone code glow", "composition_language": "B classical-figure-plus-modern-tech, asymmetric poster with large negative space right", "color_strategy": "electric blue dominant bg, black-cream hero, acid yellow accent on code nodes", "texture_strategy": "dense cross-hatching, stipple dots, halftone, paper grain, screen-print misregistration", "mood": "intellectually curious, playful, slightly absurd"},
  "visual_spec": {"hero_subject": "life-size marble sculptor figure in engraved black-cream rendering, holding chisel to a half-marble half-glowing-code column", "supporting_elements": ["articulated robotic arm mirroring the sculptor gesture", "floating code glyphs and blueprint grid fragments", "small laurel-wrapped laptop at base"], "environment": "saturated electric-blue void with faint classical entablature fragments", "composition": "Pattern B: hero left-of-center at 65% scale, robotic arm entering from top-right, negative blue space right for eye rest, eye path figure to column to arm", "spatial_relationships": "foreground sculptor, midground code-column, background faint entablature; arm overlaps column", "perspective": "slight low-angle editorial view, deep apparent focus", "lighting": "directional graphic light left, black ink shadow masses, symbolic glow from code nodes", "color_palette": ["#087FEA", "#0B0C0C", "#F3EFE5", "#F4E900"], "color_hierarchy": "saturated blue background, black-cream hero, acid-yellow accent nodes", "materials": ["marble", "aged paper", "brushed metal", "ink"], "textures": ["dense cross-hatching", "stipple dots", "halftone", "paper grain"], "atmosphere": "dry print air, crisp graphic stillness", "negative_space": "large electric-blue void right third", "typography": "no text, wordless editorial illustration"},
  "style_constraints": {"non_negotiables": ["old x new tension (sculptor x robotic arm)", "strong visual metaphor of co-carving", "engraved tactile rendering", "saturated contemporary color", "black-cream anchor", "print texture"], "preferred": ["asymmetric poster layout", "symbolic glow"], "avoid": ["glossy CGI", "stock photography", "generic robot-with-laptop", "bokeh shallow depth of field", "readable text"]},
  "reference_strategy": {"references_present": false, "reference_roles": [], "style_reference": "", "composition_reference": "", "content_reference": "", "reference_strength": null},
  "prompt_strategy": {"complexity": "standard", "reason": "complex article needs spatial relations but stays efficient", "prompt_structure": ["medium", "hero", "metaphor", "composition", "contrast", "color", "texture", "light", "mood"], "model_specific_strategy": "general: model-agnostic natural language, no vendor syntax"},
  "prompts": {"primary": "Mixed-media editorial collage in antique copperplate etching plus modern screen print: a life-size marble sculptor figure rendered in black and cream cross-hatching co-carves a towering half-stone half-glowing-code column with an articulated robotic arm that mirrors his gesture, floating code glyphs and blueprint grid fragments orbiting the column, small laurel-wrapped laptop at the base. Saturated electric blue background with faint classical entablature fragments, asymmetric poster composition with hero left-of-center and generous blue negative space right. Black-cream hero against saturated ground with acid-yellow glowing nodes as single accent, dense cross-hatching, stipple dots, halftone, paper grain and slight misregistration, directional graphic light with ink shadow masses and symbolic code glow, deep focus, antique print reproduced through modern screen printing, intellectually curious and playfully absurd editorial mood, wordless.", "compact": "Engraved marble sculptor co-carving glowing code column with robot arm, electric-blue poster collage, black-cream hero, yellow accent, print texture.", "model_specific": "Mixed-media editorial collage, marble sculptor and robotic arm co-carving half-code column, copperplate etching and screen print, electric blue background, black-cream hero with acid-yellow accents, cross-hatching and halftone, asymmetric poster composition, curious playful mood."},
  "negative_prompt": {"enabled": true, "content": "glossy CGI, stock photo, generic vector art, robot holding laptop cliche, bokeh, shallow depth of field, readable text, watermark"},
  "generation_parameters": {"aspect_ratio": "16:9", "width": null, "height": null, "resolution": null, "quality": null, "stylization": null, "seed": null, "model_parameters": {}},
  "validation": {"valid": true, "checks": ["metaphor present", "hero present", "old-new contrast", "house palette", "print texture"], "warnings": [], "missing_information": []}
}
