{
  "meta": {"schema_version": "1.0", "skill": "neoclassical-editorial-image", "style_system": "contemporary-neoclassical-editorial-collage", "target_model": "openai", "task_type": "text_to_image", "prompt_complexity": "standard"},
  "creative_brief": {"source": "reference-style transfer: founder building a startup", "topic": "founder building a startup", "thesis": "The image is really about mythic labor behind an ordinary garage beginning.", "abstract_concept": "Classical founding myth inside a contemporary garage", "visual_metaphor": "A founder-figure in rolled sleeves raising a classical pediment beam over a garage workbench covered with rocket sketches and servers", "image_goal": "Same house universe as references, new subject and composition"},
  "art_direction": {"style_name": "Contemporary Neoclassical Editorial Collage", "style_archetype": "neoclassical-pop-editorial", "historical_language": "pediment beam, draped work tunic overalls, engraved tools, laurel crate", "contemporary_language": "workbench laptop, rocket sketches, server tower, desk lamp glow", "medium": "mixed-media editorial collage, copperplate etching plus risograph", "rendering_language": "ink cross-hatching with halftone lamp glow and stippled wood", "composition_language": "C object-collision, beam and workbench colliding diagonally", "color_strategy": "electric blue bg, cream-ink hero, acid yellow lamp accent", "texture_strategy": "cross-hatching, halftone, paper grain, misregistration, ink breakup", "mood": "delightful, curious, slightly absurd, editorial"},
  "visual_spec": {"hero_subject": "founder figure in engraved overalls hoisting a classical stone pediment beam above a cluttered garage workbench", "supporting_elements": ["open laptop with rocket sketch pinned above", "server tower wrapped in laurel", "scattered blueprints and coffee cup"], "environment": "electric-blue garage interior with faint column outlines", "composition": "Pattern C: diagonal beam crashing from top-left into workbench bottom-right, founder braced center, negative blue space top-right", "spatial_relationships": "foreground workbench, midground founder, background beam and pinned sketches", "perspective": "eye-level poster view, deep focus", "lighting": "warm desk-lamp glow against cool blue field, ink shadows under bench", "color_palette": ["#087FEA", "#F3EFE5", "#0B0C0C", "#F4E900"], "color_hierarchy": "blue ground, cream-ink hero, yellow lamp accent", "materials": ["carved stone", "wood", "aged paper", "brushed metal"], "textures": ["dense cross-hatching", "halftone", "paper grain", "screen-print misregistration"], "atmosphere": "dusty garage air with paper flecks", "negative_space": "blue void top-right", "typography": "no text, wordless editorial illustration"},
  "style_constraints": {"non_negotiables": ["old x new tension (pediment x garage tech)", "founding-labor metaphor", "engraved rendering", "saturated blue", "ink-cream anchor", "print texture"], "preferred": ["diagonal collision energy"], "avoid": ["generic startup rocket launch photo", "glossy CGI", "stock office", "readable text"]},
  "reference_strategy": {"references_present": true, "reference_roles": ["style", "composition"], "style_reference": "house engraving plus saturated poster color and print texture", "composition_reference": "diagonal collision adapted, not copied", "content_reference": "new founder-garage subject only; no copied statue/laptop/yellow from any single ref", "reference_strength": 0.6},
  "prompt_strategy": {"complexity": "standard", "reason": "reference transfer: keep grammar, change subject", "prompt_structure": ["scene", "subject", "details", "constraints"], "model_specific_strategy": "openai: labeled scene/subject/details/constraints, reference roles assigned, exclusions stated"},
  "prompts": {"primary": "Scene: electric-blue garage interior with faint classical column outlines. Subject: founder figure in engraved overalls hoisting a classical stone pediment beam above a cluttered workbench. Details: mixed-media editorial collage in copperplate etching plus risograph, black-cream cross-hatching, open laptop with pinned rocket sketch, laurel-wrapped server tower, scattered blueprints and coffee cup, diagonal beam-to-bench collision composition with blue negative space top-right, acid-yellow desk-lamp glow as single accent, halftone, paper grain, misregistration, directional graphic light with ink shadows, antique print through screen printing, delightful curious editorial mood. Constraints: wordless, no readable text, no watermark, no glossy CGI or stock photo.", "compact": "Founder hoisting stone pediment over garage workbench with rocket sketches, blue engraved collage, yellow lamp accent.", "model_specific": "Create an editorial illustration. Scene: electric-blue garage with faint columns. Subject: founder in overalls hoisting stone pediment over workbench with laptop, rocket sketch, laurel server. Style: copperplate etching plus risograph, black-cream hero, acid-yellow lamp accent, print texture. Constraints: no readable text, no watermark, no photoreal stock look."},
  "negative_prompt": {"enabled": true, "content": "glossy CGI, stock photo, readable text, watermark, generic rocket launch"},
  "generation_parameters": {"aspect_ratio": "16:9", "width": null, "height": null, "resolution": null, "quality": null, "stylization": null, "seed": null, "model_parameters": {"size": "1536x1024", "quality": "high"}},
  "validation": {"valid": true, "checks": ["reference roles assigned", "house grammar kept", "new subject"], "warnings": [], "missing_information": []}
}
