{
  "meta": {"schema_version": "1.0", "skill": "neoclassical-editorial-image", "style_system": "contemporary-neoclassical-editorial-collage", "target_model": "midjourney", "task_type": "text_to_image", "prompt_complexity": "concise"},
  "creative_brief": {"source": "business article: market uncertainty", "topic": "market uncertainty and founders navigating volatility", "thesis": "The image is really about steering through unstable fortune.", "abstract_concept": "Classical fate confronted with modern volatility charts", "visual_metaphor": "A classical navigator-figure balancing on a giant astrolabe that doubles as a volatile stock chart, clutching a glowing ledger", "image_goal": "Business editorial hero with wit, not corporate gloom"},
  "art_direction": {"style_name": "Contemporary Neoclassical Editorial Collage", "style_archetype": "neoclassical-pop-editorial", "historical_language": "navigator in draped robe, astrolabe, engraved sea-chart waves, stone plinth", "contemporary_language": "candlestick chart arcs, glowing ledger tablet, ticker fragments", "medium": "mixed-media editorial collage, woodcut plus risograph", "rendering_language": "cross-hatched ink with halftone chart lines and stippled waves", "composition_language": "G surreal-scale-shift, giant instrument center with small human balancing", "color_strategy": "warm paper dominant ground, deep ink hero, ultraviolet accent on chart spike", "texture_strategy": "woodcut grain, halftone, paper tooth, ink breakup, distressed edges", "mood": "sophisticated, provocative, slightly absurd"},
  "visual_spec": {"hero_subject": "robed classical navigator figure balanced atop a giant astrolabe-chart wheel, rendered in deep ink engraving", "supporting_elements": ["candlestick chart arcs forming the astrolabe rings", "glowing ledger tablet clutched under arm", "engraved waves and small paper boats below"], "environment": "warm paper ground with terracotta wave bands and faint ticker tape strips", "composition": "Pattern G: giant wheel center at 70% scale, tiny figure on top rim, diagonal chart spike breaking frame top-right, calm negative paper space left", "spatial_relationships": "foreground waves, midground giant wheel, figure perched on wheel apex", "perspective": "straight-on poster view with slight tilt, deep focus", "lighting": "directional graphic light, ink shadow masses under wheel, paper-white highlights on foam", "color_palette": ["#F3EFE5", "#0B0C0C", "#6A39D7", "#D96532"], "color_hierarchy": "warm paper ground, ink hero, ultraviolet chart accent with terracotta support", "materials": ["aged paper", "engraved metal", "ink", "parchment"], "textures": ["woodcut grain", "halftone", "paper tooth", "distressed print edges"], "atmosphere": "windy paper-chart atmosphere, crisp graphic motion", "negative_space": "calm paper field left third", "typography": "no text, wordless editorial illustration"},
  "style_constraints": {"non_negotiables": ["old x new tension (astrolabe x candlestick chart)", "navigating-volatility metaphor", "engraved tactile rendering", "saturated accent on paper", "ink anchor", "print texture"], "preferred": ["surreal scale shift", "diagonal energy"], "avoid": ["generic corporate handshake", "generic stock chart photo", "glossy CGI", "shallow depth of field"]},
  "reference_strategy": {"references_present": false, "reference_roles": [], "style_reference": "", "composition_reference": "", "content_reference": "", "reference_strength": null},
  "prompt_strategy": {"complexity": "concise", "reason": "midjourney: concept seed with discovery room", "prompt_structure": ["concept", "style", "details", "composition", "params"], "model_specific_strategy": "midjourney: short seed + --ar --no, params last"},
  "prompts": {"primary": "Woodcut and risograph editorial collage on warm paper: a robed classical navigator figure in deep black ink engraving balances atop a giant astrolabe wheel whose rings are volatile candlestick chart arcs, clutching a small glowing ledger tablet, engraved sea waves with tiny paper boats churning below and faint ticker tape strips drifting in the sky. Surreal scale shift with the wheel at 70 percent of frame center, figure small on its apex, one ultraviolet chart spike breaking the top-right edge, calm paper negative space left. Warm paper ground with terracotta wave bands and single ultraviolet accent, dense woodcut grain, halftone chart lines, paper tooth and distressed edges, directional graphic light with ink shadow masses and paper-white foam highlights, antique print through modern screen printing, sophisticated provocative slightly absurd business-editorial mood, wordless.", "compact": "Engraved navigator balancing on giant astrolabe stock-chart wheel over paper waves, warm paper collage, ink hero, violet accent.", "model_specific": "classical navigator balancing on giant astrolabe made of candlestick chart arcs, woodcut risograph editorial collage, warm paper with terracotta waves, ultraviolet accent, surreal scale --ar 16:9 --no glossy CGI, stock photo, text, watermark"},
  "negative_prompt": {"enabled": true, "content": "generic corporate art, handshake, glossy CGI, stock chart screenshot, bokeh, readable text, watermark"},
  "generation_parameters": {"aspect_ratio": "16:9", "width": null, "height": null, "resolution": null, "quality": null, "stylization": null, "seed": null, "model_parameters": {}},
  "validation": {"valid": true, "checks": ["metaphor present", "scale shift composed", "house palette", "texture"], "warnings": [], "missing_information": []}
}
