{
  "meta": {"schema_version": "1.0", "skill": "neoclassical-editorial-image", "style_system": "contemporary-neoclassical-editorial-collage", "target_model": "flux", "task_type": "text_to_image", "prompt_complexity": "standard"},
  "creative_brief": {"source": "news: China investigates DeepSeek and Moonshot after Anthropic accuses them of secretly routing requests to Claude; 23M+12M alleged exchanges; sensitive-data concern; unresolved, nothing proven", "topic": "secret AI request routing and cross-border data investigation", "thesis": "The image is really about hidden diversion behind rival facades under unresolved scrutiny.", "abstract_concept": "Classical conduit logic applied to secret data rerouting across a border", "visual_metaphor": "A monumental engraved aqueduct-manifold with twin pavilion-server towers secretly diverting glowing scroll-streams through hidden copper tubes beneath a border wall into a veiled oracle head, watched by a giant inspector seal-magnifier", "image_goal": "News editorial hero communicating alleged secret rerouting and investigation without depicting real logos, persons, or verdicts"},
  "art_direction": {"style_name": "Contemporary Neoclassical Editorial Collage", "style_archetype": "neoclassical-pop-editorial", "historical_language": "Roman aqueduct-manifold, copperplate city plan, wax inspection seals, veiled classical oracle head, engraved scrolls", "contemporary_language": "twin server-towers, fiber and copper tubes, glowing exchange streams, inspector magnifier-lens", "medium": "mixed-media editorial collage, copperplate etching plus halftone screen print", "rendering_language": "cross-hatched stone and iron with stippled scroll paper and halftone stream glow", "composition_language": "F diagrammatic-editorial-collage, cutaway manifold with hidden tubes crossing under a border wall", "color_strategy": "electric-blue network void dominant, black-cream engraved hero, acid-yellow accent on diverted streams and seal", "texture_strategy": "dense cross-hatching, fine engraving lines, stipple dots, halftone, paper grain, screen-print misregistration", "mood": "sophisticated, provocative, watchful, slightly absurd"},
  "visual_spec": {"hero_subject": "monumental engraved aqueduct-manifold block with twin pavilion-server towers, cut open to reveal hidden copper tubes diverting glowing scroll-streams sideways", "supporting_elements": ["glowing scroll-exchange streams flowing through exposed tubes", "a segmented border wall with wax inspection seals straddling the tubes", "a veiled classical oracle head receiving the diverted streams at right", "a giant inspector seal-magnifier hovering top-left over the junction"], "environment": "saturated electric-blue network void with faint copperplate diagram grid and drifting paper flecks", "composition": "Pattern F: hero manifold center-left at 65% scale, hidden tubes running diagonally under the border wall to the veiled head at right edge, seal-magnifier top-left counterweight, blue negative space top-right, eye path towers to tubes to oracle head", "spatial_relationships": "foreground manifold cutaway, midground border wall crossing diagonally, background veiled receiver head; magnifier overlaps top-left corner", "perspective": "straight-on diagrammatic poster view with cutaway depth, deep apparent focus", "lighting": "directional graphic light left, black ink shadow masses inside cutaway, symbolic glow from diverted streams", "color_palette": ["#087FEA", "#0B0C0C", "#F3EFE5", "#F4E900"], "color_hierarchy": "saturated blue ground, black-cream hero ironwork and scrolls, acid-yellow accent confined to diverted streams and seal ring", "materials": ["carved stone", "engraved metal", "aged paper", "glass"], "textures": ["dense cross-hatching", "fine engraving lines", "stipple dots", "halftone", "paper grain"], "atmosphere": "tense still diagram air, quiet before verdict", "negative_space": "electric-blue void top-right for headline breathing room", "typography": "no text, wordless editorial illustration"},
  "style_constraints": {"non_negotiables": ["old x new tension (aqueduct x server routing)", "secret-diversion visual metaphor", "engraved tactile rendering", "saturated contemporary color", "black-cream anchor", "editorial cutaway composition", "print texture"], "preferred": ["diagrammatic cutaway reveal", "diagonal border crossing"], "avoid": ["company logos or names", "real persons", "hooded hacker cliche", "glossy CGI", "green matrix rain", "readable text"]},
  "reference_strategy": {"references_present": false, "reference_roles": [], "style_reference": "", "composition_reference": "", "content_reference": "", "reference_strength": null},
  "prompt_strategy": {"complexity": "standard", "reason": "FLUX sweet spot 30-80 words front-loaded; news needs precise spatial relations without bloat", "prompt_structure": ["subject", "action", "style", "context"], "model_specific_strategy": "flux: front-load manifold-towers diversion, HEX bound to objects, natural sentences, no negative prompt"},
  "prompts": {"primary": "Engraved editorial collage with screen-print finish: a monumental aqueduct-manifold block with twin pavilion-server towers cut open to reveal hidden copper tubes secretly diverting glowing scroll-streams sideways beneath a segmented border wall with wax inspection seals, the streams feeding a veiled classical oracle head at the right edge while a giant inspector seal-magnifier hovers top-left over the junction. Saturated electric-blue network void with faint copperplate diagram grid, diagrammatic cutaway poster composition with hero center-left and blue negative space top-right. Black-cream cross-hatched hero with acid-yellow accent confined to the diverted streams and seal ring, dense engraving lines, stipple, halftone glow, paper grain and slight misregistration, directional graphic light with ink shadow masses, antique print reproduced through modern screen printing, watchful provocative news-editorial mood, wordless and neutral with no verdict implied.", "compact": "Engraved aqueduct server-towers secretly diverting glowing scroll-streams under a sealed border wall to a veiled oracle head, blue diagram collage, yellow accent.", "model_specific": "Twin pavilion-server towers on a stone manifold secretly diverting glowing scroll-streams through hidden copper tubes under a sealed border wall into a veiled oracle head under an inspector seal-magnifier, copperplate engraving and screen-print editorial style, ironwork in deep ink #0B0C0C and scrolls in warm paper #F3EFE5 on electric-blue field #087FEA with diverted streams in acid yellow #F4E900, diagrammatic cutaway poster composition"},
  "negative_prompt": {"enabled": false, "content": ""},
  "generation_parameters": {"aspect_ratio": "16:9", "width": null, "height": null, "resolution": null, "quality": null, "stylization": null, "seed": null, "model_parameters": {"note": "FLUX has no negative prompts; exclusions folded into prose: no logos, no real persons, no readable text, no verdict implied"}},
  "validation": {"valid": true, "checks": ["metaphor present", "cutaway composition specified", "house palette", "print texture", "flux no-negative enforced", "neutral unresolved framing"], "warnings": [], "missing_information": []}
}
